{
    "name": "gdm_catalog",
    "description": "Equipment catalog for DistributionSystem models contains over 25000 models for BareConductorEquipment, CapacitorEquipment, ConcentricCableEquipment, DistributionTransformerEquipment, InverterEquipment and SolarEquipment",
    "contributor": "Aadil Latif",
    "contributed_date": "2024-12-04"
}